<?xml version="1.0" encoding="UTF-8"?>
<menus xmlns:xs="http://www.w3.org/2001/XMLSchema-instance"
       xs:noNamespaceSchemaLocation="urn:weline:module:Weline_Backend::etc/xsd/menu.xsd"
       xs:schemaLocation="urn:weline:module:Weline_Backend::etc/xsd/menu.xsd">
    
    <!-- 自动寻客主菜单 -->
    <add source="Weline_AutoLeadAgent::auto_lead_agent" 
         name="auto_lead_agent" 
         title="自动寻客" 
         action=""
         parent="Weline_Backend::system_menu"
         icon="mdi mdi-account-search" 
         order="20100"/>
    
    <!-- 任务管理子菜单 -->
    <add source="Weline_AutoLeadAgent::search_task" 
         name="search_task" 
         title="搜索任务" 
         action="auto-lead-agent/backend/index/index"
         parent="Weline_AutoLeadAgent::auto_lead_agent"
         icon="mdi mdi-magnify" 
         order="10"/>
    
    <!-- 潜在客户子菜单 -->
    <add source="Weline_AutoLeadAgent::lead_candidate" 
         name="lead_candidate" 
         title="潜在客户" 
         action="auto-lead-agent/backend/candidate/index"
         parent="Weline_AutoLeadAgent::auto_lead_agent"
         icon="mdi mdi-account-group" 
         order="20"/>
    
    <!-- Token管理子菜单 -->
    <add source="Weline_AutoLeadAgent::token_manager" 
         name="token_manager" 
         title="Token管理" 
         action="auto-lead-agent/backend/token/index"
         parent="Weline_AutoLeadAgent::auto_lead_agent"
         icon="mdi mdi-key" 
         order="30"/>
    
    <!-- WASM管理子菜单 -->
    <add source="Weline_AutoLeadAgent::wasm_manager" 
         name="wasm_manager" 
         title="WASM管理" 
         action="auto-lead-agent/backend/wasm/index"
         parent="Weline_AutoLeadAgent::auto_lead_agent"
         icon="mdi mdi-code-braces" 
         order="40"/>
    
    <!-- 配置管理子菜单 -->
    <add source="Weline_AutoLeadAgent::config" 
         name="config" 
         title="配置管理" 
         action="auto-lead-agent/backend/config"
         parent="Weline_AutoLeadAgent::auto_lead_agent"
         icon="mdi mdi-cog" 
         order="50"/>
    
    <!-- 搜索引擎映射子菜单 -->
    <add source="Weline_AutoLeadAgent::mapping" 
         name="mapping" 
         title="搜索引擎映射" 
         action="auto-lead-agent/backend/mapping/index"
         parent="Weline_AutoLeadAgent::auto_lead_agent"
         icon="mdi mdi-map-marker-multiple" 
         order="60"/>
    
    <!-- 搜索目标网站子菜单 -->
    <add source="Weline_AutoLeadAgent::target_website" 
         name="target_website" 
         title="搜索目标网站" 
         action="auto-lead-agent/backend/target-website/index"
         parent="Weline_AutoLeadAgent::auto_lead_agent"
         icon="mdi mdi-web" 
         order="70"/>
    
</menus>

